{
  "adoption_opportunity": "Audit Decodex sandbox and remote-environment assumptions for cwd handling, especially any app-server, exec-server, or tool bridge code that assumes cwd values are native host paths before the receiving filesystem validates them.",
  "caveats": "The PR is a migration of internal and protocol plumbing. It improves host-boundary semantics but does not introduce a new end-user command.",
  "changed_surfaces": [
    "filesystem sandbox context cwd representation",
    "sandbox command transform inputs",
    "core turn-environment cwd accessors",
    "remote exec-server filesystem transport",
    "tool runtime sandbox construction",
    "PathUri migration tests across core, exec-server, and sandboxing"
  ],
  "community_value": "Medium for operators using remote filesystems or sandboxed execution, because it explains why cwd values now retain URI semantics across host boundaries.",
  "compatibility_risk": "High for Decodex Control Plane integrations that inspect or construct sandbox context cwd values, because upstream now carries `PathUri` until the execution host validates and converts it.",
  "confidence": "confirmed",
  "control_plane_relevance": "High. Decodex routes tool execution, sandbox policy, and remote filesystem behavior through app-server and exec-server boundaries where cwd interpretation affects safety and correctness.",
  "deprecated_or_breaking_notes": "Native cwd interpretation is moved later in the pipeline. Non-native cwd URIs are rejected without fallback at the receiving host instead of being interpreted early as local paths.",
  "evidence": [
    "PR #27816 says sandbox cwd values should retain URI semantics across app-server and exec-server host boundaries until the receiving host validates them.",
    "`codex-rs/file-system/src/lib.rs` changes `FileSystemSandboxContext.cwd` from an absolute path to `PathUri`.",
    "`codex-rs/sandboxing/src/manager.rs` changes `SandboxCommand.cwd` to `PathUri` and adds native launch request conversion at the execution boundary.",
    "`codex-rs/core/src/session/turn_context.rs` keeps paired native and URI cwd values behind immutable accessors during migration.",
    "`codex-rs/exec-server/src/remote_file_system_path_uri_tests.rs` extends remote filesystem PathUri coverage.",
    "The normalized bundle `artifacts/github/bundles/openai-codex-pr-27816.json` records 40 changed files for the merged PR."
  ],
  "next_actions": [
    {
      "reason": "The cwd representation change can affect Decodex sandbox, tool, and remote-filesystem compatibility.",
      "type": "upstream_impact"
    },
    {
      "reason": "The change is useful as a cautious operator-impact note for remote/sandbox boundary watchers.",
      "type": "social_candidate"
    }
  ],
  "observed_change": "Codex migrates sandbox cwd handling to `PathUri` across core, sandboxing, filesystem, and exec-server boundaries.",
  "repo": "openai/codex",
  "reviewed_at": "2026-06-13T02:08:29Z",
  "schema": "upstream_review/v1",
  "slug": "openai-codex-pr-27816",
  "source_refs": {
    "items": [
      {
        "kind": "pull_request",
        "meta": "Merged 2026-06-12T18:38:02Z",
        "title": "sandboxing: migrate cwd inputs to PathUri",
        "url": "https://github.com/openai/codex/pull/27816"
      },
      {
        "kind": "commit",
        "title": "sandboxing: migrate cwd inputs to PathUri",
        "url": "https://github.com/openai/codex/commit/69a5b897facddfdb48dc4cccb173541f5349aa6f"
      }
    ]
  },
  "subject": {
    "commit_shas": [
      "69a5b897facddfdb48dc4cccb173541f5349aa6f",
      "db68524fe5280a98ae8a500448d2c7eb46b33164",
      "a57dab38147d453e05cd391eed4a3ab83a251f71"
    ],
    "subject_id": "27816",
    "subject_kind": "pr"
  },
  "user_visible_path": "Users may not see a new command, but remote and sandboxed executions should preserve cwd URI semantics more accurately across host boundaries."
}
