{
  "schema": "upstream_review/v1",
  "slug": "openai-codex-pr-26701",
  "repo": "openai/codex",
  "subject": {
    "subject_kind": "pr",
    "subject_id": "26701",
    "commit_shas": [
      "52f9ec871bedbd53a0c0741d0b7bc47e3dae3da9",
      "4d32a96c7580b022e5d906bcbb2eb283b80338f7",
      "ddd48cab1b5d617e8a01737c0665f4025b351421",
      "44448048dcad4a75a1d7056f23cc87691438268c",
      "ccf0f0d9892fd9b253401466d6dee7a1886ac407",
      "9da50461f3d23990d484b3ba29b5cb293269d23f"
    ]
  },
  "source_refs": {
    "items": [
      {
        "kind": "pull_request",
        "title": "TUI Plugin Sharing 1 - add remote plugin identity",
        "url": "https://github.com/openai/codex/pull/26701",
        "meta": "Merged 2026-06-09T23:34:39Z"
      },
      {
        "kind": "commit",
        "title": "Adjustment for admin-disabled plugins in /plugin menu",
        "url": "https://github.com/openai/codex/commit/ddd48cab1b5d617e8a01737c0665f4025b351421"
      },
      {
        "kind": "commit",
        "title": "tui: update remote plugin detail fixtures",
        "url": "https://github.com/openai/codex/commit/ccf0f0d9892fd9b253401466d6dee7a1886ac407"
      }
    ]
  },
  "reviewed_at": "2026-06-10T20:07:16Z",
  "observed_change": "Codex TUI plugin popups now carry a `PluginLocation` that can address either a local marketplace path or a remote marketplace name, letting remote plugin detail, install, and uninstall actions use remote plugin identity while preserving local plugin flows.",
  "changed_surfaces": [
    "TUI plugin popup request routing",
    "`PluginLocation` local-versus-remote identity model",
    "remote plugin detail, install, and uninstall request parameters",
    "admin-disabled plugin install and toggle affordances",
    "plugin popup tests and remote fixtures"
  ],
  "user_visible_path": "A Codex TUI user opening the plugin menu can inspect remote marketplace plugins without a local filesystem path and route install or uninstall actions by remote plugin ID; admin-disabled plugins remain blocked in the existing popup flow.",
  "control_plane_relevance": "Medium for Decodex Control Plane because plugin inventory and install surfaces now need to preserve remote plugin IDs and marketplace names separately from local marketplace paths.",
  "compatibility_risk": "Medium for local plugin tooling or UI assumptions that treat marketplace path as required identity; the PR keeps local IDs and paths intact but adds remote identity as a first-class branch.",
  "adoption_opportunity": "Update Decodex plugin readback and operator UI models to distinguish local marketplace path, remote marketplace name, plugin ID, and remote plugin ID before presenting install or uninstall actions.",
  "community_value": "High for Codex plugin users because it is an early visible step toward shared or remote plugins in the TUI without adding broad share-management UI yet.",
  "deprecated_or_breaking_notes": "No local plugin behavior is removed; the PR intentionally keeps share-management UI out of scope and only adds remote-capable identity routing for existing plugin popup flows.",
  "confidence": "confirmed",
  "evidence": [
    "PR #26701 states that plugin popup flows now address plugins from either a local marketplace path or a remote marketplace name.",
    "`codex-rs/tui/src/app_event.rs` adds `PluginLocation::Local` and `PluginLocation::Remote` plus request-parameter conversion.",
    "`codex-rs/tui/src/app/background_requests.rs` and `event_dispatch.rs` change plugin install request events from marketplace paths to `PluginLocation`.",
    "`codex-rs/tui/src/chatwidget/plugins.rs` adds remote-aware plugin source, availability, detail, install, and uninstall handling.",
    "`codex-rs/tui/src/chatwidget/tests/popups_and_settings.rs` adds coverage for remote rows, remote detail, remote install/uninstall actions, and admin-disabled plugin states.",
    "The normalized bundle `artifacts/github/bundles/openai-codex-pr-26701.json` records 7 changed files for the merged PR."
  ],
  "caveats": "The source review confirms TUI identity and action routing only; it does not claim a complete remote plugin sharing management UI or account-side sharing policy.",
  "next_actions": [
    {
      "type": "upstream_impact",
      "reason": "Remote plugin identity changes Control Plane plugin inventory and install assumptions."
    },
    {
      "type": "social_candidate",
      "reason": "The TUI remote plugin identity path has a clear public plugin-operator angle."
    },
    {
      "type": "linear_followup",
      "reason": "Decodex should verify plugin inventory and install readback can represent remote marketplace identity without requiring local paths."
    }
  ]
}
