{
  "schema": "upstream_review/v1",
  "slug": "openai-codex-pr-27383",
  "repo": "openai/codex",
  "subject": {
    "subject_kind": "pr",
    "subject_id": "27383",
    "commit_shas": [
      "9c223af9d01e5e895d668d29291c45b794eeda83",
      "6b0115c1838acfe99839e07a64bcaffbf9bebeb4"
    ]
  },
  "source_refs": {
    "items": [
      {
        "kind": "pull_request",
        "title": "Remove async-trait from extension contributors",
        "url": "https://github.com/openai/codex/pull/27383",
        "meta": "Merged 2026-06-10T12:31:09Z"
      },
      {
        "kind": "commit",
        "title": "Remove async-trait from extension contributors",
        "url": "https://github.com/openai/codex/commit/9c223af9d01e5e895d668d29291c45b794eeda83"
      }
    ]
  },
  "reviewed_at": "2026-06-10T14:15:22Z",
  "observed_change": "Codex extension contributors now return an explicit boxed `ExtensionFuture` from async contributor methods instead of relying on `async-trait`, while preserving boxed, `Send`, dynamically dispatched future behavior.",
  "changed_surfaces": [
    "extension API contributor trait signatures",
    "goal, guardian, image-generation, MCP, memories, skills, and web-search extension implementations",
    "extension API test implementations",
    "Cargo dependency metadata for extension crates"
  ],
  "user_visible_path": "Normal Codex CLI, TUI, and app-server users should not see behavior change, but out-of-tree extension implementors must match the explicit `ExtensionFuture` return contract when implementing contributor traits.",
  "control_plane_relevance": "Moderate for Decodex Control Plane because Decodex extension or plugin experiments that compile against upstream contributor traits need to track the new boxed-future API shape.",
  "compatibility_risk": "Source compatibility risk for custom extension contributors written against the prior `async fn` or `async-trait` trait style; the PR states no runtime behavior change is intended.",
  "adoption_opportunity": "Update any Decodex extension-contributor prototypes to use `ExtensionFuture` and `Box::pin(async move { ... })`, and treat this as the new object-safe contributor contract.",
  "community_value": "Medium for extension authors because it documents the object-safe async boundary directly, but low for ordinary Codex users because behavior is intended to remain unchanged.",
  "deprecated_or_breaking_notes": "`async-trait` is removed from `codex-extension-api`, `codex-guardian`, and `codex-mcp-extension` dependencies, and contributor trait method signatures now spell out the boxed future type.",
  "confidence": "confirmed",
  "evidence": [
    "PR #27383 says extension contributors are registered behind `dyn Trait` objects and replaces `async-trait` with an explicit boxed, `Send` future contract while retaining the existing runtime model.",
    "`codex-rs/ext/extension-api/src/contributors.rs` adds `pub type ExtensionFuture<'a, T> = Pin<Box<dyn Future<Output = T> + Send + 'a>>` and rewrites contributor traits to return it.",
    "`codex-rs/ext/extension-api/src/lib.rs` re-exports `ExtensionFuture` for downstream implementors.",
    "Production extensions under `codex-rs/ext/goal`, `ext/guardian`, `ext/image-generation`, `ext/mcp`, `ext/memories`, `ext/skills`, and `ext/web-search` now return `Box::pin(async move { ... })` from contributor methods.",
    "`codex-rs/ext/extension-api/Cargo.toml`, `ext/guardian/Cargo.toml`, and `ext/mcp/Cargo.toml` remove direct `async-trait` dependencies.",
    "The PR body reports targeted extension API, affected extension crate, and `codex-core` contributor tests, and the bundle records test rewrites that keep callback behavior covered."
  ],
  "caveats": "The reviewed source supports a compile-time API shape change, not a user-facing runtime behavior change; downstream extension authors still need to verify their own trait implementations.",
  "next_actions": [
    {
      "type": "upstream_impact",
      "reason": "The contributor trait signature change is a source compatibility risk for Decodex extension or plugin experiments."
    },
    {
      "type": "linear_followup",
      "reason": "Audit any Decodex-owned upstream extension API prototypes for `async-trait` contributor implementations."
    }
  ]
}
