{
  "schema": "upstream_review/v1",
  "slug": "openai-codex-pr-25177",
  "repo": "openai/codex",
  "subject": {
    "subject_kind": "pr",
    "subject_id": "25177",
    "commit_shas": [
      "074c237d6b2f061e02273af5b8ba2d7869020e10",
      "eb22256674028348ce7cb5ff6ed3b5365c11091e",
      "dfcc2221c8b46a2390a982d48ef1426aadcc4a2b",
      "c25d9987b95c0f55aeac3fc963a4d4087bf173d2",
      "666fae92fc838030f95254738138e047298f718e",
      "95e0f15865134edec8b6cc97f9983631b2607d0f",
      "12556519e8796dc575eedbac190b42e779e608e2"
    ]
  },
  "source_refs": {
    "items": [
      {
        "kind": "pull_request",
        "title": "Preserve cloud requirements across TUI thread resets",
        "url": "https://github.com/openai/codex/pull/25177",
        "meta": "Merged 2026-06-09T01:08:48Z"
      },
      {
        "kind": "commit",
        "title": "Ensure cloud_requirements persist after /new, /clear, /side, etc.",
        "url": "https://github.com/openai/codex/commit/074c237d6b2f061e02273af5b8ba2d7869020e10"
      },
      {
        "kind": "commit",
        "title": "Use cloud config bundle for TUI reloads",
        "url": "https://github.com/openai/codex/commit/c25d9987b95c0f55aeac3fc963a4d4087bf173d2"
      }
    ]
  },
  "reviewed_at": "2026-06-10T02:09:14Z",
  "observed_change": "Codex TUI config rebuilds for thread transitions now preserve the cloud config bundle loader so cloud requirements survive fresh-session and thread-reset paths.",
  "changed_surfaces": [
    "TUI config persistence and fresh-session config rebuilds",
    "cloud managed-config bundle loading",
    "external-agent config migration startup",
    "TUI regression tests for config refresh"
  ],
  "user_visible_path": "Users with cloud requirements applied can use `/new`, `/clear`, `/fork`, side conversations, or session-picker transitions without dropping cloud-managed settings such as feature requirements.",
  "control_plane_relevance": "Decodex should treat this as a watch item for managed Codex config behavior: TUI thread transitions no longer imply that cloud requirements were shed.",
  "compatibility_risk": "Low for app-server clients because no protocol field is removed, but operators who expected thread resets to clear cloud requirements should adjust that assumption.",
  "adoption_opportunity": "No immediate Decodex implementation is required; keep future config-refresh or TUI-interop code aligned with Codex preserving cloud bundles across thread transitions.",
  "community_value": "Limited outside cloud-managed Codex users because the easiest public repro depends on cloud requirements and an internal feature example.",
  "deprecated_or_breaking_notes": "No deprecated field or removed user command was identified; the behavior change is preservation of managed config across resets.",
  "confidence": "confirmed",
  "evidence": [
    "PR #25177 says `/new`, `/clear`, `/fork`, side conversations, and session picker transitions previously rebuilt config without the cloud requirements loader.",
    "codex-rs/tui/src/app/config_persistence.rs now passes `cloud_config_bundle(self.cloud_config_bundle.clone())` into both config refresh builders.",
    "codex-rs/tui/src/app.rs stores `CloudConfigBundleLoader` on the App and passes it through TUI initialization.",
    "codex-rs/tui/src/external_agent_config_migration_startup.rs accepts the cloud config bundle during migration prompt handling.",
    "The regression test `refresh_in_memory_config_from_disk_keeps_cloud_requirements_for_thread_transitions` asserts cloud approval-policy requirements still apply after config refresh.",
    "The normalized bundle artifacts/github/bundles/openai-codex-pr-25177.json records 6 changed files for the merged PR."
  ],
  "caveats": "The PR body names an internal staff-friendly feature example, so public messaging should avoid implying a broadly available feature toggle.",
  "next_actions": [
    {
      "type": "upstream_impact",
      "reason": "Managed config preservation is worth tracking as a Decodex Control Plane watch item."
    }
  ]
}
