{
  "schema": "upstream_review/v1",
  "slug": "openai-codex-pr-25147",
  "repo": "openai/codex",
  "subject": {
    "subject_kind": "pr",
    "subject_id": "25147",
    "commit_shas": [
      "09ce7e176bb3e35108cce7c74f9fe566125b6c87",
      "821b679505e5021c4fc20a3c79070d96ff0aaa24",
      "e992bdf9805440b068ffa2c031dbf3be0e244107",
      "7c54723762ae9ebb3d2bbb95e71ac5000771c9c9",
      "e4dca2440722489eb1d774ba0b273a4260f8d0e8",
      "5f2b14e092e169c3f4c9f4b93c40e2560f95e2ca",
      "d4b826175776c26f977b2e10a9dc9bc4a3030e41",
      "daf24cccd232bb9cc3035eb9985d2bf3ee24cab5",
      "b0a300fb9b9d8ee73be8d40f718eb7b9464a28be",
      "6e4c8dfa31a5fbb6216e8465337d737b7327fb6a",
      "dee789ab91d6883ca16fbc86aeadbf524d95c1ef",
      "08503d6d13e7b7efc817299c30bcf34bd7b5b076",
      "75e3421f94a530314154b3ff9dd51a1064f861f6",
      "d1596f4595d17a2e2a94a8fc45c7ceb116079868",
      "2e23b88414a393e9800c328bded2e6f2bd7ba7a7",
      "b8760d31e0e00e07aa8db22afae4ab3fb9797af4",
      "1f6a75d2ac149df0a0d8f99a531aeb65243c5d1b",
      "9dfb4be0ec69162ea9b1b10008c160a333a99df1",
      "ce34025915ff7df1c060ff0343c5b42c4f3453f9",
      "7a381f591d4bd26aabb5312d89b5c5b3d47d5a9d",
      "4f29a9e89e8f39e784336e83bc71dffc270f632d"
    ]
  },
  "source_refs": {
    "items": [
      {
        "kind": "pull_request",
        "title": "[codex] Retry streamable HTTP initialize failures",
        "url": "https://github.com/openai/codex/pull/25147",
        "meta": "Merged 2026-06-09T22:49:49Z"
      },
      {
        "kind": "commit",
        "title": "Retry streamable HTTP initialize failures",
        "url": "https://github.com/openai/codex/commit/09ce7e176bb3e35108cce7c74f9fe566125b6c87"
      },
      {
        "kind": "commit",
        "title": "Retry streamable HTTP recovery handshakes",
        "url": "https://github.com/openai/codex/commit/9dfb4be0ec69162ea9b1b10008c160a333a99df1"
      },
      {
        "kind": "commit",
        "title": "Retry tools list transient HTTP failures",
        "url": "https://github.com/openai/codex/commit/ce34025915ff7df1c060ff0343c5b42c4f3453f9"
      }
    ]
  },
  "reviewed_at": "2026-06-10T20:07:16Z",
  "observed_change": "Codex RMCP streamable HTTP startup now retries transient initialize and initialized-notification failures, recreates the transport between attempts, and retries only the read-only `tools/list` operation after initialization.",
  "changed_surfaces": [
    "RMCP streamable HTTP startup handshake",
    "retry classification for request-layer, HTTP-status, and JSON-RPC failures",
    "typed streamable HTTP adapter errors for retryable statuses",
    "read-only `tools/list` retry behavior",
    "OAuth state persistence before initialize retry",
    "streamable HTTP recovery integration tests"
  ],
  "user_visible_path": "Codex users connecting to hosted or remote MCP services, including `codex_apps`, should see fewer startup failures when initialize, initialized notification, or the first read-only `tools/list` request hits a transient HTTP or request-layer failure.",
  "control_plane_relevance": "High for Decodex Control Plane because hosted plugin and remote MCP readiness probes depend on streamable HTTP startup stability and on not replaying side-effecting tool calls.",
  "compatibility_risk": "Low; the PR deliberately limits retries to startup handshake paths and read-only `tools/list`, preserving side-effecting `tools/call` behavior while changing transient startup failures into delayed success when retries work.",
  "adoption_opportunity": "Mirror the retry distinction in Decodex MCP health checks: retry initialize and read-only capability discovery, but keep tool-call replay fail-closed unless a future source-backed contract says otherwise.",
  "community_value": "High for MCP plugin operators because it makes temporary streamable HTTP failures less likely to break startup without broad replay of mutating operations.",
  "deprecated_or_breaking_notes": "No removal is visible; the meaningful behavior change is that selected transient startup and read-only discovery failures are retried within the operation deadline.",
  "confidence": "confirmed",
  "evidence": [
    "PR #25147 says initialize failures and read-only `tools/list` failures are retried while side-effecting tool calls are intentionally not replayed.",
    "`codex-rs/rmcp-client/src/streamable_http_retry.rs` adds retry delays, initialize retry orchestration, retryable error classification, and deadline-aware sleeps.",
    "`codex-rs/rmcp-client/src/http_client_adapter.rs` surfaces retryable streamable HTTP POST statuses as typed client errors.",
    "`codex-rs/rmcp-client/src/rmcp_client.rs` wires the retry path into pending transport connection and client operations.",
    "`codex-rs/rmcp-client/tests/streamable_http_recovery.rs` covers initialize retry, initialized-notification retry, no-status request failure retry, and `tools/list` retry.",
    "The normalized bundle `artifacts/github/bundles/openai-codex-pr-25147.json` records 7 changed files for the merged PR."
  ],
  "caveats": "The review confirms retry behavior for selected streamable HTTP startup and discovery paths only; it does not justify retrying mutating MCP tool calls or treating all HTTP errors as recoverable.",
  "next_actions": [
    {
      "type": "upstream_impact",
      "reason": "MCP startup retry semantics affect Control Plane readiness, hosted plugin probes, and reliability expectations."
    },
    {
      "type": "social_candidate",
      "reason": "The retry boundary is useful public guidance for remote MCP and plugin operators."
    },
    {
      "type": "linear_followup",
      "reason": "Decodex should compare its MCP readiness probes with Codex's retry-only-startup boundary."
    }
  ]
}
