{
  "schema": "upstream_review/v1",
  "slug": "openai-codex-pr-26840",
  "repo": "openai/codex",
  "subject": {
    "subject_kind": "pr",
    "subject_id": "26840",
    "commit_shas": [
      "3c842f79d482b0f96fcf9a039264ef1896345d17",
      "758e981a1d26ae66fd2c1ff530873e378705b45b",
      "882a9b4991823dd85cfc97ebf3557bfcf6623f4d",
      "e03cce53589b3ad050d3d251741014fef5e88940",
      "ffe52eeeeb6e01460d784b230f9a260e9a89e488",
      "cf89de2c574b750f864b0f9a44fb2e136ce9e093",
      "43038a2be12ee9e09bbb23e494a069213a12ea49",
      "80f6b9758cd4938041cdf619b06c72657f13abcb",
      "18883637213c269c4e589668169cc91b52f3b38e",
      "9fba3263e8f0b6ff53ca995c40de0259cb0452a5",
      "2cfc5a19b265c1860e9bd4eb2519cf38b984464b",
      "4fc4e5baeb335cd5b6faca38e4a1bae6f623d66d",
      "6cf3f6526a586c33b27ce11ad50f54aaf366462c",
      "8a99473f3a265925e8b94e7f652c8584bc67084a",
      "bd2279b23436fa40f838d9c469c8c6029cf7cffc",
      "14a6f970c14aa660e94dbb5085e6a3e8fd3ad211",
      "3eb69a100fb57eacb88073eb944149315aab00c1",
      "1bf23e23a4360abe0be9b536a9b84ca24a13c92c",
      "ad09d4f63e134d7bdb6f7dad8d726229f6669b06"
    ]
  },
  "source_refs": {
    "items": [
      {
        "kind": "pull_request",
        "title": "Add typed file URIs",
        "url": "https://github.com/openai/codex/pull/26840",
        "meta": "Merged 2026-06-08T23:33:42Z"
      },
      {
        "kind": "commit",
        "title": "feat: add typed path URI support",
        "url": "https://github.com/openai/codex/commit/3c842f79d482b0f96fcf9a039264ef1896345d17"
      },
      {
        "kind": "commit",
        "title": "codex: keep environment IDs inside path URIs",
        "url": "https://github.com/openai/codex/commit/18883637213c269c4e589668169cc91b52f3b38e"
      }
    ]
  },
  "reviewed_at": "2026-06-09T20:07:10Z",
  "observed_change": "Codex adds a `codex-utils-path-uri` crate for immutable typed `file:` URIs that serialize as canonical URI text while still accepting legacy absolute native paths during deserialization.",
  "changed_surfaces": [
    "new codex-utils-path-uri crate",
    "Cargo workspace membership and lockfile",
    "Bazel crate definition",
    "CODEOWNERS ownership for the path-uri utility"
  ],
  "user_visible_path": "There is no direct user-facing command or app-server field in this PR, but future Codex payloads can use typed `file:` URI identifiers without eagerly interpreting them as local native paths.",
  "control_plane_relevance": "Decodex should prepare app-server, plugin, and artifact paths to accept source-preserving `file:` URI strings and convert to native paths only at explicit local filesystem boundaries.",
  "compatibility_risk": "Low immediate risk because the new type accepts legacy absolute native paths during deserialization; future fields that adopt it may change path-string assumptions.",
  "adoption_opportunity": "Use `PathUri`-style semantics for cross-process path identifiers, especially where Decodex needs to carry remote or OS-specific file references without losing URI authority or encoding.",
  "community_value": "Medium as a watch item for Codex integrators because it signals a migration toward stable file URI identifiers across process and operating-system boundaries.",
  "deprecated_or_breaking_notes": "No public field is removed in this PR; migration support preserves legacy absolute native path input.",
  "confidence": "confirmed",
  "evidence": [
    "PR #26840 says Codex needs stable `file:` URI identifiers that can cross process and OS boundaries without eagerly interpreting them as native paths.",
    "codex-rs/utils/path-uri/src/lib.rs defines `PathUri`, accepts only `file:` URLs, preserves URI path operations, serializes as canonical URI text, and keeps native conversion explicit.",
    "The PR body says deserialization accepts both URI text and legacy absolute native paths during migration.",
    "codex-rs/utils/path-uri/src/tests.rs covers POSIX paths, Windows-looking paths, UNC authorities, encoded characters, non-UTF-8 POSIX paths, hierarchy operations, and serde round trips.",
    "codex-rs/Cargo.toml and Cargo.lock add `codex-utils-path-uri` as a workspace crate, and .github/CODEOWNERS assigns the utility path.",
    "The normalized bundle artifacts/github/bundles/openai-codex-pr-26840.json records 7 changed files for the merged PR."
  ],
  "caveats": "This is enabling infrastructure; downstream behavior depends on later PRs adopting `PathUri` in protocol, plugin, or app-server payloads.",
  "next_actions": [
    {
      "type": "upstream_impact",
      "reason": "Typed file URI support is relevant to future Decodex path and app-server compatibility work."
    },
    {
      "type": "social_candidate",
      "reason": "A defer/watch Publisher handoff can preserve the migration signal without overclaiming shipped user behavior."
    }
  ]
}
