{
  "schema": "upstream_review/v1",
  "slug": "openai-codex-pr-26230",
  "repo": "openai/codex",
  "subject": {
    "subject_kind": "pr",
    "subject_id": "26230",
    "commit_shas": [
      "d6528ccc954f1768a3d7d080bba8162b59d982a1",
      "bf84a984d0233936cf29c72dd60d704b9182d569",
      "8e14f2d413ef8a826d45a0602573148c6c7ac358"
    ]
  },
  "source_refs": {
    "items": [
      {
        "kind": "pull_request",
        "title": "fix: preserve auto review across config and delegation",
        "url": "https://github.com/openai/codex/pull/26230",
        "meta": "Merged 2026-06-08T18:59:51Z"
      },
      {
        "kind": "commit",
        "title": "fix: preserve Auto Review across config and tasks",
        "url": "https://github.com/openai/codex/commit/d6528ccc954f1768a3d7d080bba8162b59d982a1"
      },
      {
        "kind": "commit",
        "title": "fix: align app-server auto review serialization",
        "url": "https://github.com/openai/codex/commit/bf84a984d0233936cf29c72dd60d704b9182d569"
      }
    ]
  },
  "reviewed_at": "2026-06-09T08:08:13Z",
  "observed_change": "Codex makes `auto_review` the canonical serialized approval reviewer value while still accepting legacy `guardian_subagent` input and propagating the active reviewer into spawned agents.",
  "changed_surfaces": [
    "app-server protocol v2 approval reviewer serialization",
    "core protocol config type serialization",
    "config/debug output expectations",
    "multi-agent spawn runtime overrides",
    "TUI feature-flag config tests"
  ],
  "user_visible_path": "Users and managed-config operators should see `approvals_reviewer = \"auto_review\"` in output and config paths, while existing `guardian_subagent` inputs remain accepted; delegated work should preserve Auto Review instead of falling back to user review.",
  "control_plane_relevance": "Decodex config, app-server protocol, and delegated-agent adapters should treat `auto_review` as the canonical reviewer value and preserve reviewer settings across spawned-agent boundaries.",
  "compatibility_risk": "High for strict clients or stored expectations that only accepted serialized `guardian_subagent`; lower for readers because upstream keeps `guardian_subagent` as an alias.",
  "adoption_opportunity": "Update Control Plane schema expectations, debug-config parsing, and delegated-agent setup to use `auto_review` while retaining legacy-input compatibility.",
  "community_value": "High for operators using Auto Review and delegated work because the change stabilizes reviewer identity across config, app-server round trips, and spawned agents.",
  "deprecated_or_breaking_notes": "`guardian_subagent` remains accepted as backward-compatible input, but canonical output changes to `auto_review` across core protocol and app-server v2.",
  "confidence": "confirmed",
  "evidence": [
    "PR #26230 states `auto_review` is the canonical value across protocol and app-server output while `guardian_subagent` remains accepted as backward-compatible input.",
    "codex-rs/app-server-protocol/src/protocol/v2/shared.rs changes `ApprovalsReviewer::AutoReview` serde rename to `auto_review` and keeps `guardian_subagent` as an alias.",
    "codex-rs/protocol/src/config_types.rs changes both serde rename and strum serialization for `AutoReview` to `auto_review` while preserving the legacy alias.",
    "codex-rs/core/src/tools/handlers/multi_agents_common.rs copies `turn.config.approvals_reviewer` into spawned-agent config overrides.",
    "codex-rs/core/src/tools/handlers/multi_agents_tests.rs adds regression coverage for delegated task reviewer propagation.",
    "TUI and debug-config tests update expected config/debug output from `guardian_subagent` to `auto_review`.",
    "The normalized bundle artifacts/github/bundles/openai-codex-pr-26230.json records 8 changed files for the merged PR."
  ],
  "caveats": "The review covers serialization and propagation behavior; it does not evaluate the broader Guardian policy changes split into adjacent PRs.",
  "next_actions": [
    {
      "type": "upstream_impact",
      "reason": "Canonical approval-reviewer serialization and delegated-agent propagation are Control Plane compatibility concerns."
    },
    {
      "type": "social_candidate",
      "reason": "The config/protocol migration has a clear operator-facing public angle."
    }
  ]
}
