{
  "schema": "upstream_review/v1",
  "slug": "openai-codex-pr-26674",
  "repo": "openai/codex",
  "subject": {
    "subject_kind": "pr",
    "subject_id": "26674",
    "commit_shas": [
      "045c529265ced1ae8eeeb81f9e3e5186b74109f0",
      "6ae6451e144f9f76e1ea34754ba1d4f8204d3d1a"
    ]
  },
  "source_refs": {
    "items": [
      {
        "kind": "pull_request",
        "title": "protocol: remove submission-side serde from Op",
        "url": "https://github.com/openai/codex/pull/26674",
        "meta": "Merged 2026-06-05T22:41:14Z"
      },
      {
        "kind": "commit",
        "title": "protocol: remove submission-side serde from Op",
        "url": "https://github.com/openai/codex/commit/045c529265ced1ae8eeeb81f9e3e5186b74109f0"
      },
      {
        "kind": "commit",
        "title": "Restore request_user_input response serde",
        "url": "https://github.com/openai/codex/commit/6ae6451e144f9f76e1ea34754ba1d4f8204d3d1a"
      }
    ]
  },
  "reviewed_at": "2026-06-08T14:08:38Z",
  "observed_change": "Codex removed serde/schema support from submission-side Op payloads while preserving event/API-facing serialization where wire consumers still exist.",
  "changed_surfaces": [
    "codex protocol Submission and Op Rust types",
    "submission-only payload serde/schema annotations",
    "request_user_input tool output serialization boundary",
    "protocol v1 documentation"
  ],
  "user_visible_path": "Normal Codex users should not see a new command path, but protocol consumers should treat submission payloads as internal Rust handoff types rather than stable serialized wire contracts.",
  "control_plane_relevance": "Decodex Control Plane code should avoid depending on serialized Submission or Op payloads and should continue treating events and explicit app-server APIs as the transport surface.",
  "compatibility_risk": "Any downstream adapter that serialized or deserialized core Op submissions directly now has a compatibility risk; event/API serialization remains the supported boundary according to the PR.",
  "adoption_opportunity": "Audit Decodex protocol assumptions to ensure app-server integrations consume event/API-facing payloads instead of submission-side Op serde.",
  "community_value": "This is useful as a cautious protocol-watch note for integrators, but it is too internal for a strong public feature post by itself.",
  "deprecated_or_breaking_notes": "Submission, Op, and several submission-only payload types lost serde/schema annotations; the PR explicitly keeps event/API-facing serialization where still required.",
  "confidence": "confirmed",
  "evidence": [
    "PR #26674 says submission-side Op payloads are now internal handoff types and no longer need a stable serde contract.",
    "codex-rs/protocol/src/protocol.rs removes Deserialize, Serialize, and JsonSchema derives from Submission, Op, TurnEnvironmentSelection, and related submission-only payloads.",
    "codex-rs/docs/protocol_v1.md now states Op submissions are primarily in-process Rust types rather than a stable serde wire contract.",
    "The PR body says event/API-facing serialization remains where required.",
    "The follow-up commit restores request_user_input response serde by serializing the wire payload rather than relying on the core response struct.",
    "The normalized bundle artifacts/github/bundles/openai-codex-pr-26674.json records 2 changed files for the merged PR."
  ],
  "caveats": "The change is about submission-side payloads, not a blanket removal of protocol event serialization.",
  "next_actions": [
    {
      "type": "upstream_impact",
      "reason": "Protocol boundary clarification creates a Decodex compatibility watch item for serialized submission assumptions."
    }
  ]
}
