{
  "schema": "upstream_review/v1",
  "slug": "openai-codex-pr-26639",
  "repo": "openai/codex",
  "subject": {
    "subject_kind": "pr",
    "subject_id": "26639",
    "commit_shas": [
      "b5eae7326947ad4e7e7003a3f6925f370fb85407",
      "84b8997c6c294c8e63ea1e85c53e9ef01ed022de",
      "1b50304606151d6071fb68c7dbb09597b6d8c100"
    ]
  },
  "source_refs": {
    "items": [
      {
        "kind": "pull_request",
        "title": "fix(tui): scope MCP startup status by thread",
        "url": "https://github.com/openai/codex/pull/26639",
        "meta": "Merged 2026-06-08T03:12:05Z"
      },
      {
        "kind": "commit",
        "title": "fix(tui): scope MCP startup status by thread",
        "url": "https://github.com/openai/codex/commit/b5eae7326947ad4e7e7003a3f6925f370fb85407"
      },
      {
        "kind": "commit",
        "title": "fix(tui): deliver MCP startup updates to side threads",
        "url": "https://github.com/openai/codex/commit/84b8997c6c294c8e63ea1e85c53e9ef01ed022de"
      },
      {
        "kind": "commit",
        "title": "fix(app-server): allow app-scoped MCP startup events",
        "url": "https://github.com/openai/codex/commit/1b50304606151d6071fb68c7dbb09597b6d8c100"
      }
    ]
  },
  "reviewed_at": "2026-06-09T02:05:45Z",
  "observed_change": "Codex adds nullable `threadId` ownership to app-server MCP startup notifications and routes TUI MCP startup diagnostics to the owning thread.",
  "changed_surfaces": [
    "app-server protocol schema and generated TypeScript",
    "app-server MCP startup notification construction",
    "TUI app-server notification targeting",
    "TUI side-thread event buffering and MCP startup replay",
    "MCP startup warning deduplication tests"
  ],
  "user_visible_path": "When a spawned subagent has MCP startup failures, the parent TUI transcript should no longer receive repeated yellow warnings; the child thread keeps the detailed failure and final incomplete-startup summary, and stale startup spinners should settle after thread refresh.",
  "control_plane_relevance": "Decodex app-server clients and protocol adapters should accept and preserve `mcpServer/startupStatus/updated.threadId`, including `null` for app-scoped startup, when routing MCP lifecycle status.",
  "compatibility_risk": "High for exhaustive or generated app-server clients that assumed `{ name, status, error }` was the full MCP startup notification payload or that route every missing-thread notification into the active transcript.",
  "adoption_opportunity": "Update Decodex Control Plane app-server handling to use thread-scoped MCP startup status as an ownership signal and to treat null `threadId` as app-scoped rather than current-thread scoped.",
  "community_value": "High for app-server and multi-agent users because the fix reduces noisy parent-thread warnings and documents a protocol field external clients need to handle.",
  "deprecated_or_breaking_notes": "The notification shape changes from `{ name, status, error }` to `{ threadId, name, status, error }`; tests preserve deserialization of missing `threadId` as `None`, but clients with strict schemas may need updates.",
  "confidence": "confirmed",
  "evidence": [
    "PR #26639 says subagent MCP startup failures were rendered as global notifications and could pollute the parent transcript.",
    "codex-rs/app-server-protocol/src/protocol/v2/mcp.rs adds `pub thread_id: Option<String>` to `McpServerStatusUpdatedNotification`.",
    "The generated JSON schemas and TypeScript type add nullable `threadId` to `mcpServer/startupStatus/updated` notifications.",
    "codex-rs/app-server/README.md documents `{ threadId, name, status, error }` and says `threadId` is null when startup is app-scoped.",
    "codex-rs/app-server/src/bespoke_event_handling.rs populates `thread_id` from the current app-server conversation id for thread-scoped lifecycle updates.",
    "codex-rs/tui/src/app/app_server_event_targets.rs routes MCP startup notifications by thread and returns `AppScoped` when `threadId` is absent.",
    "codex-rs/tui/src/chatwidget/mcp_startup.rs suppresses identical repeated failure warnings for the same server in one startup round.",
    "The normalized bundle artifacts/github/bundles/openai-codex-pr-26639.json records 18 changed files for the merged PR."
  ],
  "caveats": "The PR documents current thread-scoped lifecycle and future app-scoped support; app-scoped null notifications are ignored by the TUI until there is an app-level target.",
  "next_actions": [
    {
      "type": "upstream_impact",
      "reason": "This is an app-server protocol and Control Plane routing compatibility change."
    },
    {
      "type": "social_candidate",
      "reason": "The protocol and multi-agent behavior change has a clear operator-facing public angle."
    }
  ]
}
