{
  "schema": "upstream_review/v1",
  "slug": "openai-codex-pr-27375",
  "repo": "openai/codex",
  "subject": {
    "subject_kind": "pr",
    "subject_id": "27375",
    "commit_shas": [
      "90fc87dd1a1c7449323fcff804c77abfea377a23"
    ]
  },
  "source_refs": {
    "items": [
      {
        "kind": "pull_request",
        "title": "[codex] Tag multi-agent spawn metrics with version",
        "url": "https://github.com/openai/codex/pull/27375",
        "meta": "Merged 2026-06-10T11:06:49Z"
      },
      {
        "kind": "commit",
        "title": "multi-agent: tag spawn metric with version",
        "url": "https://github.com/openai/codex/commit/90fc87dd1a1c7449323fcff804c77abfea377a23"
      }
    ]
  },
  "reviewed_at": "2026-06-10T14:15:22Z",
  "observed_change": "Codex multi-agent spawn telemetry now tags the shared `codex.multi_agent.spawn` counter with `version=v1` for the legacy path and `version=v2` for the multi-agent v2 path.",
  "changed_surfaces": [
    "legacy multi-agent spawn telemetry",
    "multi-agent v2 spawn telemetry"
  ],
  "user_visible_path": "None; this PR changes analytics dimensions only and does not alter the user-facing spawn-agent behavior.",
  "control_plane_relevance": "Watch-only relevance for Decodex analytics because the version tag can separate legacy and v2 multi-agent adoption if Decodex later consumes upstream telemetry semantics.",
  "compatibility_risk": "None identified for app-server, plugin, MCP, sandbox, config, or user workflows; existing metric consumers should tolerate an added tag dimension.",
  "adoption_opportunity": "Use the `version` dimension only if Decodex builds analytics or release-rollup reasoning around upstream multi-agent v1 versus v2 adoption.",
  "community_value": "Low as a standalone public signal because the change improves internal telemetry segmentation rather than user-visible functionality.",
  "deprecated_or_breaking_notes": "No deprecated, removed, migration, or breaking behavior was found.",
  "confidence": "confirmed",
  "evidence": [
    "PR #27375 says the shared `codex.multi_agent.spawn` metric is emitted by both runtimes and adds a bounded version tag to distinguish v2 adoption from aggregate spawning.",
    "`codex-rs/core/src/tools/handlers/multi_agents/spawn.rs` adds `(version, v1)` to the legacy spawn counter labels.",
    "`codex-rs/core/src/tools/handlers/multi_agents_v2/spawn.rs` adds `(version, v2)` to the v2 spawn counter labels.",
    "The normalized bundle `artifacts/github/bundles/openai-codex-pr-27375.json` records only the two telemetry call-site changes."
  ],
  "caveats": "The PR body states tests and Clippy were left to CI; the source evidence is still sufficient for the analytics-only classification.",
  "next_actions": [
    {
      "type": "none",
      "reason": "Review trace is enough; no impact, signal, social, or Linear follow-up is warranted from an analytics tag-only change."
    }
  ]
}
