{
  "schema": "upstream_review/v1",
  "slug": "openai-codex-pr-26859",
  "repo": "openai/codex",
  "subject": {
    "subject_kind": "pr",
    "subject_id": "26859",
    "commit_shas": [
      "57659383ec35538c75d4f35ea8348edd740a0435",
      "bf636e08e83562fce57cdfd0ca64e0ebafec106f",
      "186490d934d112d51c400dd54b7f5c887023cd0d",
      "bc9a3b9cbc07d1ac22fad1f499c51568301884cd"
    ]
  },
  "source_refs": {
    "items": [
      {
        "kind": "pull_request",
        "title": "fix: Auto-recover from corrupted sqlite databases",
        "url": "https://github.com/openai/codex/pull/26859",
        "meta": "Merged 2026-06-10T18:24:29Z"
      },
      {
        "kind": "commit",
        "title": "fix: Auto-recover from corrupted sqlite databases",
        "url": "https://github.com/openai/codex/commit/57659383ec35538c75d4f35ea8348edd740a0435"
      },
      {
        "kind": "commit",
        "title": "PR feedback -- fixing auto recovery to ensure it doesn't recover non-hosed dbs",
        "url": "https://github.com/openai/codex/commit/bc9a3b9cbc07d1ac22fad1f499c51568301884cd"
      }
    ]
  },
  "reviewed_at": "2026-06-11T08:09:15Z",
  "observed_change": "Codex now treats detected local runtime SQLite corruption as a backup-and-rebuild path for the interactive CLI and app server, moving only the damaged database files aside and surfacing recovery context to the user.",
  "changed_surfaces": [
    "local SQLite runtime initialization and recovery helpers",
    "interactive CLI startup retry and user notification flow",
    "app-server state database startup and config warning context",
    "doctor remediation text for damaged SQLite databases",
    "TUI startup error database-path reporting",
    "runtime recovery unit tests"
  ],
  "user_visible_path": "When the interactive CLI or app server encounters recoverable SQLite corruption, Codex backs up the damaged runtime database and sidecars under a backup directory, creates a fresh database that can be rebuilt from saved rollouts, and tells the user which database was backed up and where the new one lives.",
  "control_plane_relevance": "High for Decodex Control Plane because local app-server startup and state readback can now continue after a corrupt runtime database by emitting recovery context instead of requiring manual database removal.",
  "compatibility_risk": "Moderate for supervisors that interpreted SQLite corruption as a terminal startup failure; lock contention and non-corruption startup errors still fail closed, but recoverable corruption now produces backup paths and a rebuilt runtime database.",
  "adoption_opportunity": "Teach Decodex operator recovery and app-server probes to recognize the SQLite recovery warning, preserve backup-path evidence, and avoid treating a rebuilt local database as silent data loss.",
  "community_value": "High for Codex desktop, CLI, and app-server operators because a class of corrupt local database incidents can recover automatically while preserving the damaged files for inspection.",
  "deprecated_or_breaking_notes": "The doctor guidance changes from only backing up and manually removing or repairing the affected database to restarting the interactive CLI or app server so those entry points can rebuild automatically.",
  "confidence": "confirmed",
  "evidence": [
    "PR #26859 says corruption from an older SQLite version cannot fully preserve the root database, but rollout data on disk allows Codex to back up the corrupt database and rebuild runtime state.",
    "`codex-rs/state/src/runtime/recovery.rs` adds `RuntimeDbBackup` plus backup-and-rebuild helpers that move only the corrupted runtime database and SQLite sidecars under `db-backups`.",
    "`codex-rs/app-server/src/lib.rs` switches state runtime startup to `init_sqlite_state_db_with_fresh_start_on_corruption` and defines the warning summary `Codex rebuilt its local database.`.",
    "`codex-rs/cli/src/main.rs` changes interactive startup from one attempted repair flag to a set of attempted database backups and retries only when `is_auto_backup_recoverable` matches the startup error.",
    "`codex-rs/cli/src/doctor.rs` updates remediation to tell users to move the damaged SQLite database aside and restart the interactive CLI or app server so it can rebuild from saved data.",
    "`codex-rs/tui/src/lib.rs` and `startup_error.rs` carry the specific database path from corruption errors instead of always reporting the state database path.",
    "`codex-rs/state/src/runtime/recovery_tests.rs` covers moving only the requested runtime database files to the backup folder.",
    "The normalized bundle `artifacts/github/bundles/openai-codex-pr-26859.json` records 13 changed files for the merged PR."
  ],
  "caveats": "The source confirms automatic recovery for interactive CLI and app-server entry points; other entry points may still require manual recovery, and the rebuilt runtime database depends on saved rollout files being available.",
  "next_actions": [
    {
      "type": "upstream_impact",
      "reason": "The startup recovery behavior changes Decodex app-server failure handling and operator recovery evidence."
    },
    {
      "type": "social_candidate",
      "reason": "Automatic SQLite backup-and-rebuild is a clear public reliability improvement for Codex operators."
    },
    {
      "type": "linear_followup",
      "reason": "Decodex should recognize and preserve SQLite recovery warnings in operator readback and recovery runbooks."
    }
  ]
}
